{"type":"config","name":"Optimize react-native-reanimated unit test runtime","metricName":"total_s","metricUnit":"s","bestDirection":"lower"}
{"run":1,"commit":"030c075","metric":14.511,"metrics":{"tests_passed":898,"suites_passed":36,"tests_failed":0,"suites_failed":0},"status":"keep","description":"Baseline: 36 suites, 898 tests, ~14.5s","timestamp":1774350809658,"segment":0,"confidence":null,"asi":{"hypothesis":"baseline measurement","slowest_tests":"plugin.test.ts ~13-18s, InterpolateColor ~11-16s","jest_config":"react-native preset, babel-jest, no cache, node env"}}
{"run":2,"commit":"f293382","metric":9.462,"metrics":{"tests_passed":898,"suites_passed":36,"tests_failed":0,"suites_failed":0},"status":"keep","description":"Add transformIgnorePatterns to skip transforming most node_modules (was transforming everything)","timestamp":1774350873417,"segment":0,"confidence":null,"asi":{"hypothesis":"transformIgnorePatterns:[] was forcing babel to transform ALL node_modules files; restricting to only needed packages saves ~5s","improvement":"14.5s -> 9.5s (-35%)","key_insight":"The empty transformIgnorePatterns array was the single biggest perf problem"}}
{"run":3,"commit":"f293382","metric":9.316,"metrics":{"tests_passed":898,"suites_passed":36,"tests_failed":0,"suites_failed":0},"status":"discard","description":"Test-only babel config with single @react-native/babel-preset (removing redundant preset-env + preset-typescript)","timestamp":1774351016932,"segment":0,"confidence":34.58219178082215,"asi":{"hypothesis":"Removing redundant babel presets would speed up transforms","rollback_reason":"No improvement - within noise of previous 9.46s","next_action_hint":"Try maxWorkers tuning, or look at specific slow tests like plugin.test.ts"}}
{"run":4,"commit":"625c177","metric":8.442,"metrics":{"tests_passed":898,"suites_passed":36,"tests_failed":0,"suites_failed":0},"status":"keep","description":"Set maxWorkers=50% to reduce worker overhead (13->6-7 workers). 9.5s->8.4s","timestamp":1774351175313,"segment":0,"confidence":11.900000000000004,"asi":{"hypothesis":"Too many workers cause overhead with 36 small test suites","improvement":"9.5s -> 8.4s (-11%)","key_insight":"Even 2-3 workers perform similarly because bottleneck is single slow suite (InterpolateColor ~8.7s)"}}
{"run":5,"commit":"625c177","metric":9.142,"metrics":{"tests_passed":898,"suites_passed":36,"tests_failed":0,"suites_failed":0},"status":"discard","description":"Split into Jest projects (css vs core) to avoid loading full setup for CSS tests","timestamp":1774351265912,"segment":0,"confidence":34.879310344827324,"asi":{"hypothesis":"Separate Jest projects for CSS tests (no setup) and core tests (full setup) would be faster","rollback_reason":"Projects overhead made it slower: 9.1s vs 8.4s","next_action_hint":"Focus on reducing babel transform time or test execution time itself"}}
{"run":6,"commit":"d9b6d7c","metric":8.275,"metrics":{"tests_passed":898,"suites_passed":36,"tests_failed":0,"suites_failed":0},"status":"keep","description":"Disable source maps in babel-jest transform to reduce overhead","timestamp":1774351339910,"segment":0,"confidence":12.22745098039216,"asi":{"hypothesis":"Source map generation adds babel overhead that's unnecessary for tests","improvement":"~8.4s -> ~8.3s, marginal but clean","key_insight":"Source maps are small overhead compared to actual babel transforms"}}
{"run":7,"commit":"e51a631","metric":8.166,"metrics":{"tests_passed":898,"suites_passed":36,"tests_failed":0,"suites_failed":0},"status":"keep","description":"Use test-only babel config with single @react-native/babel-preset (removes redundant preset-env + preset-typescript)","timestamp":1774351415054,"segment":0,"confidence":9.064285714285722,"asi":{"hypothesis":"Removing redundant babel presets from test transform reduces per-file overhead","improvement":"8.28s -> 8.17s, small but real","key_insight":"The main babel.config.js had 3 presets doing overlapping work"}}
{"run":8,"commit":"bbc8c41f","metric":7.905,"metrics":{"tests_passed":898,"suites_passed":36,"tests_failed":0,"suites_failed":0},"status":"keep","description":"Set maxWorkers=3 (optimal for this test suite size, less IPC overhead than 50%/6-7 workers)","timestamp":1774351558907,"segment":0,"confidence":11.488695652173908,"asi":{"hypothesis":"Fewer workers reduce IPC overhead when most tests share similar initialization cost","improvement":"8.17s -> 7.9s (-3%)","key_insight":"maxWorkers=3 is optimal. 2 is slightly slower (8.1s), 4-7 progressively worse due to IPC overhead"}}
{"run":9,"commit":"bbc8c41","metric":7.906,"metrics":{"tests_passed":898,"suites_passed":36,"tests_failed":0,"suites_failed":0},"status":"discard","description":"Inline react-native preset instead of using preset: 'react-native' (avoid asset transformer config)","timestamp":1774351605744,"segment":0,"confidence":12.30167597765363,"asi":{"hypothesis":"Inlining preset config avoids loading unnecessary asset transformers","rollback_reason":"No measurable improvement - 7.91s vs 7.91s","next_action_hint":"Look at reducing babel plugin cost or test-level optimizations"}}
{"run":10,"commit":"bbc8c41","metric":8.127,"metrics":{"tests_passed":898,"suites_passed":36,"tests_failed":0,"suites_failed":0},"status":"discard","description":"Custom test sequencer to run slowest tests first for better parallelization","timestamp":1774351691483,"segment":0,"confidence":14.58278145695366,"asi":{"hypothesis":"Running slowest tests first would improve parallel utilization","rollback_reason":"Slightly worse (8.13s vs 7.91s) - default sequencer already handles this or the overhead of the custom sequencer negates benefits","next_action_hint":"Try reducing babel overhead via plugin exclusion for node_modules or lighter transform"}}
{"run":11,"commit":"bbc8c41","metric":7.959,"metrics":{"tests_passed":898,"suites_passed":36,"tests_failed":0,"suites_failed":0},"status":"discard","description":"Separate transform for node_modules (without reanimated plugin) vs source files","timestamp":1774351724621,"segment":0,"confidence":17.90243902439021,"asi":{"hypothesis":"Skip reanimated babel plugin for node_modules transforms","rollback_reason":"No improvement (7.96s vs 7.91s) - transformIgnorePatterns already excludes most node_modules so few files go through the heavier transform","next_action_hint":"Try reducing the number of babel plugins in @react-native/babel-preset or use ts-jest"}}
{"run":12,"commit":"bbc8c41","metric":0,"metrics":{"tests_passed":0,"suites_passed":0,"tests_failed":0,"suites_failed":36},"status":"crash","description":"Tried minimal babel config without @react-native/babel-preset — Flow and JSX syntax not supported","timestamp":1774351799958,"segment":0,"confidence":17.90243902439021,"asi":{"hypothesis":"Minimal babel config (preset-env + preset-typescript + preset-react) would be faster","rollback_reason":"RN polyfills use Flow syntax (type, mixed) requiring Hermes parser from @react-native/babel-preset. Custom JSX config also didn't work.","next_action_hint":"Can't easily replace @react-native/babel-preset - it's needed for Flow support in RN internals. Try other approaches."}}
